<?xml version="1.0"?>
<!DOCTYPE residues SYSTEM "residues.dtd">

<residues>
  <residue restype="ACE">
    <ratom name="CA">
    <ratom name="HA1">
    <ratom name="HA2">
    <ratom name="HA3">
    <ratom name="C">
    <ratom name="O">
    <rbond a1="CA" a2="HA1"/>
    <rbond a1="CA" a2="HA2"/>
    <rbond a1="CA" a2="HA3"/>
    <rbond a1="CA" a2="C"/>
    <rbond a1="C" a2="O"/>
    <raddh hclass="aliphatic" addgeom="4" addnum="3" addto="CA C O"/>
  </residue>

  <residue restype="ALA">
    <ratom name="N">
    <ratom name="H">
    <ratom name="CA">
    <ratom name="HA">
    <ratom name="CB">
    <ratom name="HB1">
    <ratom name="HB2">
    <ratom name="HB3">
    <ratom name="C">
    <ratom name="O">
    <rbond a1="N" a2="H"/>
    <rbond a1="N" a2="CA"/>
    <rbond a1="CA" a2="HA"/>
    <rbond a1="CA" a2="CB"/>
    <rbond a1="CA" a2="C"/>
    <rbond a1="CB" a2="HB1"/>
    <rbond a1="CB" a2="HB2"/>
    <rbond a1="CB" a2="HB3"/>
    <rbond a1="C" a2="O"/>
    <rbond a1="-C" a2="N"/>
    <rimproper a1="N" a2="-C" a3="CA" a4="H"/>
    <rimproper a1="-C" a2="-CA" a3="N" a4="-O"/>
    <rimproper a1="CA" a2="N" a3="C" a4="CB"/>
    <raddh hclass="polar"     addgeom="1" addnum="1" addto="N -C CA"/>
    <raddh hclass="aliphatic" addgeom="5" addnum="1" addto="CA N C CB"/>
    <raddh hclass="aliphatic" addgeom="4" addnum="3" addto="CB CA N"/>
  </residue>

  <residue restype="ARG">
    <ratom name="N">
    <ratom name="H">
    <ratom name="CA">
    <ratom name="HA">
    <ratom name="CB">
    <ratom name="HB1">
    <ratom name="HB2">
    <ratom name="CG">
    <ratom name="HG1">
    <ratom name="HG2">
    <ratom name="CD">
    <ratom name="HD1">
    <ratom name="HD2">
    <ratom name="NE">
    <ratom name="HE">
    <ratom name="CZ">
    <ratom name="NH1">
    <ratom name="HH11">
    <ratom name="HH12">
    <ratom name="NH2">
    <ratom name="HH21">
    <ratom name="HH22">
    <ratom name="C">
    <ratom name="O">
    <rbond a1="N" a2="H"/>
    <rbond a1="N" a2="CA"/>
    <rbond a1="CA" a2="HA"/>
    <rbond a1="CA" a2="CB"/>
    <rbond a1="CA" a2="C"/>
    <rbond a1="CB" a2="HB1"/>
    <rbond a1="CB" a2="HB2"/>
    <rbond a1="CB" a2="CG"/>
    <rbond a1="CG" a2="HG1"/>
    <rbond a1="CG" a2="HG2"/>
    <rbond a1="CG" a2="CD"/>
    <rbond a1="CD" a2="HD1"/>
    <rbond a1="CD" a2="HD2"/>
    <rbond a1="CD" a2="NE"/>
    <rbond a1="NE" a2="HE"/>
    <rbond a1="NE" a2="CZ"/>
    <rbond a1="CZ" a2="NH1"/>
    <rbond a1="CZ" a2="NH2"/>
    <rbond a1="NH1" a2="HH11"/>
    <rbond a1="NH1" a2="HH12"/>
    <rbond a1="NH2" a2="HH21"/>
    <rbond a1="NH2" a2="HH22"/>
    <rbond a1="C" a2="O"/>
    <rbond a1="-C" a2="N"/>
    <rimproper a1="N" a2="-C" a3="CA" a4="H"/>
    <rimproper a1="-C" a2="-CA" a3="N" a4="-O"/>
    <rimproper a1="CA" a2="N" a3="C" a4="CB"/>
    <rimproper a1="NE" a2="CD" a3="CZ" a4="HE"/>
    <rimproper a1="CZ" a2="NH1" a3="NH2" a4="NE"/>
    <rimproper a1="NH1" a2="HH11" a3="HH12" a4="CZ"/>
    <rimproper a1="NH2" a2="HH21" a3="HH22" a4="CZ"/>
    <raddh hclass="polar"     addgeom="1" addnum="1" addto="N -C CA"/>
    <raddh hclass="aliphatic" addgeom="5" addnum="1" addto="CA N C CB"/>
    <raddh hclass="aliphatic" addgeom="6" addnum="2" addto="CB CG CA"/>
    <raddh hclass="aliphatic" addgeom="6" addnum="2" addto="CG CD CB"/>
    <raddh hclass="aliphatic" addgeom="6" addnum="2" addto="CD NE CG"/>
    <raddh hclass="polar"     addgeom="1" addnum="1" addto="NE CD CZ"/>
    <raddh hclass="polar"     addgeom="3" addnum="2" addto="NH1 CZ NE"/>
    <raddh hclass="polar"     addgeom="3" addnum="2" addto="NH2 CZ NE"/>
  </residue>

  <residue restype="ASN">
    <ratom name="N">
    <ratom name="H">
    <ratom name="CA">
    <ratom name="HA">
    <ratom name="CB">
    <ratom name="HB1">
    <ratom name="HB2">
    <ratom name="CG">
    <ratom name="OD1">
    <ratom name="ND2">
    <ratom name="HD21">
    <ratom name="HD22">
    <ratom name="C">
    <ratom name="O">
    <rbond a1="N" a2="H"/>
    <rbond a1="N" a2="CA"/>
    <rbond a1="CA" a2="HA"/>
    <rbond a1="CA" a2="CB"/>
    <rbond a1="CA" a2="C"/>
    <rbond a1="CB" a2="HB1"/>
    <rbond a1="CB" a2="HB2"/>
    <rbond a1="CB" a2="CG"/>
    <rbond a1="CG" a2="OD1"/>
    <rbond a1="CG" a2="ND2"/>
    <rbond a1="ND2" a2="HD21"/>
    <rbond a1="ND2" a2="HD22"/>
    <rbond a1="C" a2="O"/>
    <rbond a1="-C" a2="N"/>
    <rimproper a1="N" a2="-C" a3="CA" a4="H"/>
    <rimproper a1="-C" a2="-CA" a3="N" a4="-O"/>
    <rimproper a1="CA" a2="N" a3="C" a4="CB"/>
    <rimproper a1="CG" a2="OD1" a3="ND2" a4="CB"/>
    <rimproper a1="ND2" a2="HD21" a3="HD22" a4="CG"/>
    <raddh hclass="polar"     addgeom="1" addnum="1" addto="N -C CA"/>
    <raddh hclass="aliphatic" addgeom="5" addnum="1" addto="CA N C CB"/>
    <raddh hclass="aliphatic" addgeom="6" addnum="2" addto="CB CG CA"/>
    <raddh hclass="polar"     addgeom="3" addnum="2" addto="ND2 CG CB"/>
  </residue>

  <residue restype="ASP">
    <ratom name="N">
    <ratom name="H">
    <ratom name="CA">
    <ratom name="HA">
    <ratom name="CB">
    <ratom name="HB1">
    <ratom name="HB2">
    <ratom name="CG">
    <ratom name="OD1">
    <ratom name="OD2">
    <ratom name="C">
    <ratom name="O">
    <rbond a1="N" a2="H"/>
    <rbond a1="N" a2="CA"/>
    <rbond a1="CA" a2="HA"/>
    <rbond a1="CA" a2="CB"/>
    <rbond a1="CA" a2="C"/>
    <rbond a1="CB" a2="HB1"/>
    <rbond a1="CB" a2="HB2"/>
    <rbond a1="CB" a2="CG"/>
    <rbond a1="CG" a2="OD1"/>
    <rbond a1="CG" a2="OD2"/>
    <rbond a1="C" a2="O"/>
    <rbond a1="-C" a2="N"/>
    <rimproper a1="N" a2="-C" a3="CA" a4="H"/>
    <rimproper a1="-C" a2="-CA" a3="N" a4="-O"/>
    <rimproper a1="CA" a2="N" a3="C" a4="CB"/>
    <rimproper a1="CG" a2="OD1" a3="OD2" a4="CB"/>
    <raddh hclass="polar"     addgeom="1" addnum="1" addto="N -C CA"/>
    <raddh hclass="aliphatic" addgeom="5" addnum="1" addto="CA N C CB"/>
    <raddh hclass="aliphatic" addgeom="6" addnum="2" addto="CB CG CA"/>
  </residue>

  <residue restype="ASPH">
    <ratom name="N">
    <ratom name="H">
    <ratom name="CA">
    <ratom name="HA">
    <ratom name="CB">
    <ratom name="HB1">
    <ratom name="HB2">
    <ratom name="CG">
    <ratom name="OD1">
    <ratom name="OD2">
    <ratom name="HD2">
    <ratom name="C">
    <ratom name="O">
    <rbond a1="N" a2="H"/>
    <rbond a1="N" a2="CA"/>
    <rbond a1="CA" a2="HA"/>
    <rbond a1="CA" a2="CB"/>
    <rbond a1="CA" a2="C"/>
    <rbond a1="CB" a2="HB1"/>
    <rbond a1="CB" a2="HB2"/>
    <rbond a1="CB" a2="CG"/>
    <rbond a1="CG" a2="OD1"/>
    <rbond a1="CG" a2="OD2"/>
    <rbond a1="OD2" a2="HD2"/>
    <rbond a1="C" a2="O"/>
    <rbond a1="-C" a2="N"/>
    <rimproper a1="N" a2="-C" a3="CA" a4="H"/>
    <rimproper a1="-C" a2="-CA" a3="N" a4="-O"/>
    <rimproper a1="CA" a2="N" a3="C" a4="CB"/>
    <rimproper a1="CG" a2="OD1" a3="OD2" a4="CB"/>
    <raddh hclass="polar"     addgeom="1" addnum="1" addto="N -C CA"/>
    <raddh hclass="aliphatic" addgeom="5" addnum="1" addto="CA N C CB"/>
    <raddh hclass="aliphatic" addgeom="6" addnum="2" addto="CB CG CA"/>
    <raddh hclass="polar"     addgeom="2" addnum="1" addto="OD1 CG CB"/>
  </residue>

  <residue restype="CYS2">
    <ratom name="N">
    <ratom name="H">
    <ratom name="CA">
    <ratom name="HA">
    <ratom name="CB">
    <ratom name="HB1">
    <ratom name="HB2">
    <ratom name="SG">
    <ratom name="C">
    <ratom name="O">
    <rbond a1="N" a2="H"/>
    <rbond a1="N" a2="CA"/>
    <rbond a1="CA" a2="HA"/>
    <rbond a1="CA" a2="CB"/>
    <rbond a1="CA" a2="C"/>
    <rbond a1="CB" a2="HB1"/>
    <rbond a1="CB" a2="HB2"/>
    <rbond a1="CB" a2="SG"/>
    <rbond a1="C" a2="O"/>
    <rbond a1="-C" a2="N"/>
    <rimproper a1="N" a2="-C" a3="CA" a4="H"/>
    <rimproper a1="-C" a2="-CA" a3="N" a4="-O"/>
    <rimproper a1="CA" a2="N" a3="C" a4="CB"/>
    <raddh hclass="polar"     addgeom="1" addnum="1" addto="N -C CA"/>
    <raddh hclass="aliphatic" addgeom="5" addnum="1" addto="CA N C CB"/>
    <raddh hclass="aliphatic" addgeom="6" addnum="2" addto="CB SG CA"/>
  </residue>

  <residue restype="CYSH">
    <ratom name="N">
    <ratom name="H">
    <ratom name="CA">
    <ratom name="HA">
    <ratom name="CB">
    <ratom name="HB1">
    <ratom name="HB2">
    <ratom name="SG">
    <ratom name="HG">
    <ratom name="C">
    <ratom name="O">
    <rbond a1="N" a2="H"/>
    <rbond a1="N" a2="CA"/>
    <rbond a1="CA" a2="HA"/>
    <rbond a1="CA" a2="CB"/>
    <rbond a1="CA" a2="C"/>
    <rbond a1="CB" a2="HB1"/>
    <rbond a1="CB" a2="HB2"/>
    <rbond a1="CB" a2="SG"/>
    <rbond a1="SG" a2="HG"/>
    <rbond a1="C" a2="O"/>
    <rbond a1="-C" a2="N"/>
    <rimproper a1="N" a2="-C" a3="CA" a4="H"/>
    <rimproper a1="-C" a2="-CA" a3="N" a4="-O"/>
    <rimproper a1="CA" a2="N" a3="C" a4="CB"/>
    <raddh hclass="polar"     addgeom="1" addnum="1" addto="N -C CA"/>
    <raddh hclass="aliphatic" addgeom="5" addnum="1" addto="CA N C CB"/>
    <raddh hclass="aliphatic" addgeom="6" addnum="2" addto="CB SG CA"/>
    <raddh hclass="aliphatic" addgeom="2" addnum="1" addto="SG CB CA"/>
  </residue>

  <residue restype="GLN">
    <ratom name="N">
    <ratom name="H">
    <ratom name="CA">
    <ratom name="HA">
    <ratom name="CB">
    <ratom name="HB1">
    <ratom name="HB2">
    <ratom name="CG">
    <ratom name="HG1">
    <ratom name="HG2">
    <ratom name="CD">
    <ratom name="OE1">
    <ratom name="NE2">
    <ratom name="HE21">
    <ratom name="HE22">
    <ratom name="C">
    <ratom name="O">
    <rbond a1="N" a2="H"/>
    <rbond a1="N" a2="CA"/>
    <rbond a1="CA" a2="HA"/>
    <rbond a1="CA" a2="CB"/>
    <rbond a1="CA" a2="C"/>
    <rbond a1="CB" a2="HB1"/>
    <rbond a1="CB" a2="HB2"/>
    <rbond a1="CB" a2="CG"/>
    <rbond a1="CG" a2="HG1"/>
    <rbond a1="CG" a2="HG2"/>
    <rbond a1="CG" a2="CD"/>
    <rbond a1="CD" a2="OE1"/>
    <rbond a1="CD" a2="NE2"/>
    <rbond a1="NE2" a2="HE21"/>
    <rbond a1="NE2" a2="HE22"/>
    <rbond a1="C" a2="O"/>
    <rbond a1="-C" a2="N"/>